otvoritev,barva,stevilo_iger,eco,datum,performance_rating,povprecen_rating,zmaga,remi,poraz,poteze"Gruenfeld Defense, Exchange Variation",black,11262,D85,2022-07-28,2274,2298,28.6,34.5,36.9,1.d4 Nf6 2.c4 g6 3.Nc3 d5 4.cxd5 Nxd5
"Gruenfeld Defense, Exchange Variation, Classical Variation",white,3226,D86,2022-07-22,2308,2275,32.4,34.5,33.1,1.d4 Nf6 2.c4 g6 3.Nc3 d5 4.cxd5 Nxd5 5.e4 Nxc3 6.bxc3 Bg7 7.Bc4
"Gruenfeld Defense, Exchange Variation, Larsen Variation",black,105,D86,2021-03-16,2321,2409,29.5,32.4,38.1,1.d4 Nf6 2.c4 g6 3.Nc3 d5 4.cxd5 Nxd5 5.e4 Nxc3 6.bxc3 Bg7 7.Bc4 O-O 8.Ne2 Qd7
"Gruenfeld Defense, Exchange Variation, Modern Exchange Variation",white,10031,D85,2022-07-28,2335,2294,35.6,36.5,27.9,1.d4 Nf6 2.c4 g6 3.Nc3 d5 4.cxd5 Nxd5 5.e4 Nxc3 6.bxc3 Bg7 7.Nf3
"Gruenfeld Defense, Exchange Variation, Modern Exchange Variation, Kramnik's line",white,364,D85,2022-07-24,2435,2385,42.6,32.7,24.7,1.d4 Nf6 2.c4 g6 3.Nc3 d5 4.cxd5 Nxd5 5.e4 Nxc3 6.bxc3 Bg7 7.Nf3 c5 8.h3
"Gruenfeld Defense, Exchange Variation, Modern Exchange Variation, Pawn Grab line",black,293,D85,2022-07-09,2176,2242,22.2,24.6,53.2,1.d4 Nf6 2.c4 g6 3.Nc3 d5 4.cxd5 Nxd5 5.e4 Nxc3 6.bxc3 Bg7 7.Nf3 c5 8.Rb1 O-O 9.Be2 Nc6 10.d5 Bxc3+
"Gruenfeld Defense, Exchange Variation, Nadanian Attack",white,444,D85,2022-07-23,2295,2255,38.5,30.4,31.1,1.d4 Nf6 2.c4 g6 3.Nc3 d5 4.cxd5 Nxd5 5.Na4
"Gruenfeld Defense, Exchange Variation, Seville Variation",white,292,D87,2022-07-03,2315,2283,31.2,40.8,28.1,1.d4 Nf6 2.c4 g6 3.Nc3 d5 4.cxd5 Nxd5 5.e4 Nxc3 6.bxc3 Bg7 7.Bc4 O-O 8.Ne2 c5 9.O-O Nc6 10.Be3 Bg4 11.f3 Na5 12.Bxf7+
"Gruenfeld Defense, Exchange Variation, Simagin's Improved Variation",black,560,D86,2022-02-22,2332,2367,32.5,31.6,35.9,1.d4 Nf6 2.c4 g6 3.Nc3 d5 4.cxd5 Nxd5 5.e4 Nxc3 6.bxc3 Bg7 7.Bc4 O-O 8.Ne2 Nc6
"Gruenfeld Defense, Exchange Variation, Sokolsky Variation",white,437,D89,2022-07-01,2304,2301,38.7,30.7,30.7,1.d4 Nf6 2.c4 g6 3.Nc3 d5 4.cxd5 Nxd5 5.e4 Nxc3 6.bxc3 Bg7 7.Bc4 O-O 8.Ne2 c5 9.O-O Nc6 10.Be3 cxd4 11.cxd4 Bg4 12.f3 Na5 13.Bd3 Be6 14.d5
"Gruenfeld Defense, Exchange Variation, Spassky Variation",white,900,D88,2022-07-24,2177,2157,41.0,32.7,26.3,1.d4 Nf6 2.c4 g6 3.Nc3 d5 4.cxd5 Nxd5 5.e4 Nxc3 6.bxc3 Bg7 7.Bc4 O-O 8.Ne2 c5 9.O-O Nc6 10.Be3 cxd4 11.cxd4
"Gruenfeld Defense, Exchange Variation, Spassky Variation",black,2663,D87,2022-07-25,2228,2269,31.5,29.4,39.0,1.d4 Nf6 2.c4 g6 3.Nc3 d5 4.cxd5 Nxd5 5.e4 Nxc3 6.bxc3 Bg7 7.Bc4 O-O 8.Ne2 c5
"Gruenfeld Defense, Exchange Variation, Spassky Variation",black,465,D89,2022-03-08,2252,2275,28.0,36.3,35.7,1.d4 Nf6 2.c4 g6 3.Nc3 d5 4.cxd5 Nxd5 5.e4 Nxc3 6.bxc3 Bg7 7.Bc4 O-O 8.Ne2 c5 9.O-O Nc6 10.Be3 cxd4 11.cxd4 Bg4 12.f3 Na5 13.Bd3 Be6
"Gruenfeld Defense, Flohr Defense",black,129,D94,2022-01-25,2296,2340,19.4,44.2,36.4,1.d4 Nf6 2.c4 g6 3.Nc3 d5 4.Nf3 Bg7 5.e3 O-O 6.Bd3 c6 7.O-O Bf5
"Gruenfeld Defense, Flohr Variation",white,488,D90,2022-06-25,2425,2403,41.2,34.0,24.8,1.d4 Nf6 2.c4 g6 3.Nc3 d5 4.Nf3 Bg7 5.Qa4+
"Gruenfeld Defense, General",black,5131,D80,2022-07-24,2260,2279,30.9,31.5,37.6,1.d4 Nf6 2.c4 g6 3.Nc3 d5
"Gruenfeld Defense, Lutikov Variation",white,137,D70,2021-07-05,2192,2163,43.8,19.0,37.2,1.d4 Nf6 2.c4 g6 3.Nc3 d5 4.f3
"Gruenfeld Defense, Makogonov Variation",white,574,D94,2022-04-12,2373,2352,36.6,38.3,25.1,1.d4 Nf6 2.c4 g6 3.Nc3 d5 4.Nf3 Bg7 5.e3 O-O 6.b4
"Gruenfeld Defense, Opocensky Variation",white,565,D94,2022-07-24,2357,2352,28.9,42.3,28.9,1.d4 Nf6 2.c4 g6 3.Nc3 d5 4.Nf3 Bg7 5.e3 O-O 6.Bd2
"Gruenfeld Defense, Russian Variation",white,1041,D96,2022-07-19,2315,2270,45.8,27.4,26.8,1.d4 Nf6 2.c4 g6 3.Nc3 d5 4.Nf3 Bg7 5.Qb3
"Gruenfeld Defense, Russian Variation, Accelerated Variation",white,534,D81,2022-07-21,2398,2372,41.2,33.0,25.8,1.d4 Nf6 2.c4 g6 3.Nc3 d5 4.Qb3
"Gruenfeld Defense, Russian Variation, Byrne (Simagin) Variation",black,740,D97,2022-07-02,2345,2361,28.5,36.1,35.4,1.d4 Nf6 2.c4 g6 3.Nc3 d5 4.Nf3 Bg7 5.Qb3 dxc4 6.Qxc4 O-O 7.e4 Nc6
"Gruenfeld Defense, Russian Variation, Hungarian Variation",black,1361,D97,2022-07-10,2359,2388,27.4,35.6,37.0,1.d4 Nf6 2.c4 g6 3.Nc3 d5 4.Nf3 Bg7 5.Qb3 dxc4 6.Qxc4 O-O 7.e4 a6
"Gruenfeld Defense, Russian Variation, Prins Variation",black,918,D97,2022-04-15,2362,2388,29.7,34.0,36.3,1.d4 Nf6 2.c4 g6 3.Nc3 d5 4.Nf3 Bg7 5.Qb3 dxc4 6.Qxc4 O-O 7.e4 Na6
"Gruenfeld Defense, Russian Variation, Smyslov Variation",black,496,D98,2022-07-11,2338,2384,26.8,38.5,34.7,1.d4 Nf6 2.c4 g6 3.Nc3 d5 4.Nf3 Bg7 5.Qb3 dxc4 6.Qxc4 O-O 7.e4 Bg4
"Gruenfeld Defense, Russian Variation, Smyslov Variation",white,184,D99,2021-08-31,2527,2438,42.9,35.9,21.2,1.d4 Nf6 2.c4 g6 3.Nc3 d5 4.Nf3 Bg7 5.Qb3 dxc4 6.Qxc4 O-O 7.e4 Bg4 8.Be3 Nfd7 9.Qb3
"Gruenfeld Defense, Russian Variation, Szabo (Boleslavsky)",black,469,D97,2022-06-27,2188,2247,20.9,31.3,47.8,1.d4 Nf6 2.c4 g6 3.Nc3 d5 4.Nf3 Bg7 5.Qb3 dxc4 6.Qxc4 O-O 7.e4 c6
"Gruenfeld Defense, Russian Variation, With e4",white,321,D97,2022-07-02,2384,2314,42.7,28.4,29.0,1.d4 Nf6 2.c4 g6 3.Nc3 d5 4.Nf3 Bg7 5.Qb3 dxc4 6.Qxc4 O-O 7.e4
"Gruenfeld Defense, Smyslov Defense",black,848,D94,2022-07-10,2292,2327,16.3,48.0,35.7,1.d4 Nf6 2.c4 g6 3.Nc3 d5 4.Nf3 Bg7 5.e3 O-O 6.Bd3 c6 7.O-O Bg4
"Gruenfeld Defense, Three Knights Variation",black,3325,D90,2022-07-28,2263,2281,31.8,31.0,37.2,1.d4 Nf6 2.c4 g6 3.Nc3 d5 4.Nf3 Bg7
"Gruenfeld Defense, Three Knights Variation, Burille Variation",white,2548,D94,2022-07-24,2131,2115,30.6,29.9,39.5,1.d4 Nf6 2.c4 g6 3.Nc3 d5 4.Nf3 Bg7 5.e3
"Gruenfeld Defense, Three Knights Variation, Burille Variation, Reversed Tarrasch",black,1346,D94,2022-07-10,2302,2294,44.6,33.6,21.8,1.d4 Nf6 2.c4 g6 3.Nc3 d5 4.Nf3 Bg7 5.e3 c5 6.Be2 cxd4 7.exd4 Nc6 8.O-O O-O
"Gruenfeld Defense, Three Knights Variation, Hungarian Attack",white,2059,D92,2022-07-23,2295,2268,36.5,35.0,28.5,1.d4 Nf6 2.c4 g6 3.Nc3 d5 4.Nf3 Bg7 5.Bf4
"Gruenfeld Defense, Three Knights Variation, Hungarian Variation",white,2250,D93,2022-07-24,2229,2192,33.1,32.9,34.0,1.d4 Nf6 2.c4 g6 3.Nc3 d5 4.Nf3 Bg7 5.Bf4 O-O 6.e3
"Gruenfeld Defense, Three Knights Variation, Paris Variation",white,530,D94,2022-06-28,1886,1893,21.7,24.3,54.0,1.d4 Nf6 2.c4 g6 3.Nc3 d5 4.Nf3 Bg7 5.e3 O-O 6.Bd3
"Gruenfeld Defense, Three Knights Variation, Petrosian System",white,5781,D91,2022-07-29,2286,2270,33.6,34.4,32.1,1.d4 Nf6 2.c4 g6 3.Nc3 d5 4.Nf3 Bg7 5.Bg5
"Gruenfeld Defense, Three Knights Variation, Vienna Variation",white,457,D95,2022-05-25,2304,2237,44.9,33.9,21.2,1.d4 Nf6 2.c4 g6 3.Nc3 d5 4.Nf3 Bg7 5.e3 O-O 6.Qb3
"Gruenfeld Defense, Zaitsev Gambit",white,210,D80,2022-07-19,2277,2242,44.8,28.1,27.1,1.d4 Nf6 2.c4 g6 3.Nc3 d5 4.h4
"Gunderam Defense, General",black,740,C40,2022-06-12,2061,2147,32.2,21.2,46.6,1.e4 e5 2.Nf3 Qe7
"Horwitz Defense, General",black,13502,A40,2022-07-26,2127,2161,33.5,26.9,39.6,1.d4 e6
"Hungarian Opening, Catalan Formation",black,235,A00,2022-05-15,2033,2073,23.4,20.4,56.2,1.g3 d5 2.Bg2 e6
"Hungarian Opening, Dutch Defense",black,630,A00,2022-06-25,2203,2229,28.3,28.9,42.9,1.g3 f5
"Hungarian Opening, General",white,9305,A00,2022-07-25,2264,2254,40.0,27.9,32.1,1.g3
"Hungarian Opening, Indian Defense",black,4878,A00,2022-07-25,2209,2215,25.5,29.8,44.7,1.g3 Nf6
"Hungarian Opening, Reversed Modern Defense",black,237,A00,2022-07-24,2163,2155,35.4,25.3,39.2,1.g3 d5 2.Bg2 c5
"Hungarian Opening, Sicilian Invitation",black,1833,A00,2022-07-09,2273,2279,30.6,30.3,39.1,1.g3 c5
"Hungarian Opening, Slav Formation",black,1811,A00,2022-07-24,2301,2316,31.8,32.1,36.1,1.g3 d5 2.Bg2 c6
"Hungarian Opening, Symmetrical Variation",black,3786,A00,2022-07-16,2263,2284,26.4,32.3,41.3,1.g3 g6
"Indian Game Defense, Pseudo-Queen's Indian, Marienbad System",black,566,A47,2022-06-30,2354,2378,39.6,36.8,23.7,1.d4 Nf6 2.Nf3 b6 3.g3 Bb7 4.Bg2 c5
"Indian Game, Anti-Grünfeld, Advance Variation",white,222,E60,2022-04-24,2305,2271,41.0,25.2,33.8,1.d4 Nf6 2.c4 g6 3.d5
"Indian Game, Anti-Grünfeld, Alekhine Variation",white,1467,D70,2022-07-13,2376,2352,40.1,25.6,34.4,1.d4 Nf6 2.c4 g6 3.f3
"Indian Game, Anti-Grünfeld, Alekhine Variation, Leko Gambit",black,100,D70,2021-12-17,2276,2272,34.0,28.0,38.0,1.d4 Nf6 2.c4 g6 3.f3 e5
"Indian Game, Anti-Nimzo-indian",white,15319,E10,2022-07-27,2334,2295,36.7,32.5,30.8,1.d4 Nf6 2.c4 e6 3.Nf3
"Indian Game, Budapest Defense",black,1294,A51,2022-07-24,1955,1941,48.0,19.4,32.6,1.d4 Nf6 2.c4 e5
"Indian Game, Colle System, King's Indian Variation",black,395,A48,2022-07-24,1947,1932,52.7,22.3,25.1,1.d4 Nf6 2.Nf3 g6 3.e3 Bg7 4.Bd3 d6
"Indian Game, Czech-Indian",black,387,A46,2022-04-19,2130,2145,34.9,24.3,40.8,1.d4 Nf6 2.Nf3 c6
"Indian Game, Dzindzi-Indian Defense",black,818,E10,2022-07-21,2366,2400,32.8,31.9,35.3,1.d4 Nf6 2.c4 e6 3.Nf3 a6
"Indian Game, General",black,32378,A45,2022-07-29,2129,2148,41.8,21.9,36.2,1.d4 Nf6
"Indian Game, Gibbins-Wiedehagen Gambit, Accepted",black,107,A45,2022-04-19,2264,2248,43.9,14.0,42.1,1.d4 Nf6 2.g4 Nxg4
"Indian Game, Kingside Fianchetto",black,7846,E61,2022-07-25,2143,2161,36.1,26.2,37.8,1.d4 Nf6 2.c4 g6
"Indian Game, Knights Variation, General",white,10421,A46,2022-07-30,2258,2235,33.3,33.6,33.1,1.d4 Nf6 2.Nf3
"Indian Game, London System",white,10526,A46,2022-07-28,2176,2148,35.6,28.2,36.2,1.d4 Nf6 2.Nf3 e6 3.Bf4
"Indian Game, London System",white,12633,A48,2022-07-28,2138,2113,33.7,27.9,38.5,1.d4 Nf6 2.Nf3 g6 3.Bf4
"Indian Game, Normal Variation",white,453,A50,2022-07-08,2367,2316,41.5,23.0,35.5,1.d4 Nf6 2.c4
"Indian Game, Paleface Attack",white,132,A45,2022-03-30,1931,1941,34.9,14.4,50.8,1.d4 Nf6 2.f3
"Indian Game, Polish Variation",black,872,A46,2022-07-07,2220,2276,34.4,26.9,38.6,1.d4 Nf6 2.Nf3 b5
"Indian Game, Przepiorka Variation",white,10315,A49,2022-07-25,2265,2246,34.3,33.2,32.5,1.d4 Nf6 2.Nf3 g6 3.g3
"Indian Game, Pseudo-Benko",black,2284,A46,2022-07-24,2260,2306,30.1,24.1,45.8,1.d4 Nf6 2.Nf3 c5 3.d5 b5
"Indian Game, Pseudo-King's Indian Variation",black,11511,A49,2022-07-24,2201,2214,36.0,29.4,34.6,1.d4 Nf6 2.Nf3 g6
"Indian Game, Pseudo-Queen's Indian",black,3730,A47,2022-07-28,2226,2270,36.1,28.6,35.3,1.d4 Nf6 2.Nf3 b6
"Indian Game, Queen's Pawn Opening",black,4050,E00,2022-07-25,2024,2054,36.9,19.4,43.7,1.d4 Nf6 2.c4 e6
"Indian Game, Reversed Chigorin Defense",black,871,A45,2022-07-24,2180,2199,38.2,22.2,39.6,1.d4 Nf6 2.Nc3 c5
"Indian Game, Saemisch-Indian",black,2359,A50,2022-07-24,2265,2320,37.8,24.5,37.8,1.d4 Nf6 2.c4 b6
"Indian Game, Seirawan Attack",white,684,E00,2022-07-24,2039,2009,31.7,21.4,46.9,1.d4 Nf6 2.c4 e6 3.Bg5
"Indian Game, Spielmann-Indian",black,8583,A46,2022-07-25,2202,2217,42.6,28.7,28.7,1.d4 Nf6 2.Nf3 c5
"Indian Game, Tartakower Attack",white,4461,A45,2022-07-24,2228,2217,38.0,29.9,32.1,1.d4 Nf6 2.g3
"Indian Game, Wade-Tarkatower Defense",black,8223,A46,2022-07-24,2188,2221,33.5,28.1,38.4,1.d4 Nf6 2.Nf3 d6
"Indian Game, Yusupov-Rubinstein System",white,10014,A46,2022-07-29,2247,2220,33.7,31.4,35.0,1.d4 Nf6 2.Nf3 e6 3.e3
"Italian Game, Anti-Fried Liver Defense",black,1008,C55,2022-07-24,1509,1546,22.9,12.5,64.6,1.e4 e5 2.Nf3 Nc6 3.Bc4 h6
"Italian Game, Bird's Attack",white,645,C53,2022-07-11,2215,2211,41.7,21.9,36.4,1.e4 e5 2.Nf3 Nc6 3.Bc4 Bc5 4.c3 Nf6 5.b4
"Italian Game, Classical Variation",black,144,C53,2022-04-08,1943,1943,41.7,16.7,41.7,1.e4 e5 2.Nf3 Nc6 3.Bc4 Bc5 4.c3 Nf6
"Italian Game, Classical Variation, Albin Gambit",white,517,C53,2022-07-16,1956,1946,43.1,20.1,36.8,1.e4 e5 2.Nf3 Nc6 3.Bc4 Bc5 4.c3 Nf6 5.O-O
"Italian Game, Classical Variation, Center Atttack",white,577,C53,2022-07-24,1943,1910,61.9,13.0,25.1,1.e4 e5 2.Nf3 Nc6 3.Bc4 Bc5 4.c3 Nf6 5.d4
"Italian Game, Classical Variation, Center Holding Variation",black,259,C53,2022-07-24,2201,2275,31.3,24.3,44.4,1.e4 e5 2.Nf3 Nc6 3.Bc4 Bc5 4.c3 Qe7 5.d4 Bb6
"Italian Game, Classical Variation, Closed Variation",black,638,C53,2022-07-09,2068,2105,37.8,18.2,44.0,1.e4 e5 2.Nf3 Nc6 3.Bc4 Bc5 4.c3 Qe7
"Italian Game, Classical Variation, De la Bourdonnais Variation",black,349,C53,2022-07-16,1970,1992,33.2,20.9,45.9,1.e4 e5 2.Nf3 Nc6 3.Bc4 Bc5 4.c3 d6 5.d4 exd4 6.cxd4 Bb6
"Italian Game, Classical Variation, General",white,1385,C53,2022-07-24,1866,1835,56.8,17.3,25.9,1.e4 e5 2.Nf3 Nc6 3.Bc4 Bc5 4.c3
"Italian Game, Classical Variation, Giuoco Pianissimo",white,16841,C53,2022-07-24,2217,2188,39.9,29.7,30.4,1.e4 e5 2.Nf3 Nc6 3.Bc4 Bc5 4.c3 Nf6 5.d3
"Italian Game, Classical Variation, Giuoco Pianissimo, Main line",white,676,C53,2022-06-04,2441,2401,35.6,39.5,24.9,1.e4 e5 2.Nf3 Nc6 3.Bc4 Bc5 4.c3 Nf6 5.d3 a6 6.Bb3 Ba7 7.h3 O-O 8.O-O d6 9.Re1
"Italian Game, Classical Variation, Greco Gambit",black,1797,C53,2022-07-24,2218,2242,35.6,30.1,34.3,1.e4 e5 2.Nf3 Nc6 3.Bc4 Bc5 4.c3 Nf6 5.d4 exd4 6.e5 d5
"Italian Game, Classical Variation, Greco Gambit, Anderssen Variation",black,573,C54,2022-07-24,1953,2017,27.8,22.5,49.7,1.e4 e5 2.Nf3 Nc6 3.Bc4 Bc5 4.c3 Nf6 5.d4 exd4 6.e5 d5 7.Bb5 Ne4 8.cxd4 Bb4+
"Italian Game, Classical Variation, Greco Gambit, Greco Variation",black,145,C54,2022-03-25,1697,1746,26.9,15.2,57.9,1.e4 e5 2.Nf3 Nc6 3.Bc4 Bc5 4.c3 Nf6 5.d4 exd4 6.cxd4 Bb4+ 7.Nc3 Nxe4 8.O-O Nxc3
"Italian Game, Classical Variation, Greco Gambit, Main Line",black,191,C54,2022-05-23,1880,1867,52.9,18.3,28.8,1.e4 e5 2.Nf3 Nc6 3.Bc4 Bc5 4.c3 Nf6 5.d4 exd4 6.cxd4 Bb4+ 7.Nc3 Nxe4 8.O-O Bxc3
"Italian Game, Classical Variation, Greco Gambit, Mason Gambit",white,235,C54,2010-04-10,2230,2222,36.6,25.5,37.9,1.e4 e5 2.Nf3 Nc6 3.Bc4 Bc5 4.c3 Nf6 5.d4 exd4 6.O-O
"Italian Game, Classical Variation, Greco Gambit, Moeller-Therkatz Attack",white,823,C54,2022-07-24,1976,1982,31.7,20.7,47.6,1.e4 e5 2.Nf3 Nc6 3.Bc4 Bc5 4.c3 Nf6 5.d4 exd4 6.cxd4 Bb4+ 7.Nc3 Nxe4 8.O-O Bxc3 9.d5
"Italian Game, Classical Variation, Greco Gambit, Traditional Line",white,2968,C54,2022-07-24,1989,1948,34.7,29.1,36.1,1.e4 e5 2.Nf3 Nc6 3.Bc4 Bc5 4.c3 Nf6 5.d4 exd4 6.cxd4
"Italian Game, Deutz Gambit",white,1095,C55,2022-07-24,2087,2052,44.5,20.8,34.7,1.e4 e5 2.Nf3 Nc6 3.Bc4 Bc5 4.O-O Nf6 5.d4
"Italian Game, Evans Gambit, Anderssen Defense",black,134,C52,2022-07-15,2094,2019,43.3,15.7,41.0,1.e4 e5 2.Nf3 Nc6 3.Bc4 Bc5 4.b4 Bxb4 5.c3 Ba5 6.d4 exd4 7.O-O Nf6
"Italian Game, Evans Gambit, Anderssen Variation",black,387,C51,2022-07-24,1971,1987,33.3,17.6,49.1,1.e4 e5 2.Nf3 Nc6 3.Bc4 Bc5 4.b4 Bxb4 5.c3 Be7
"Italian Game, Evans Gambit, Anderssen Variation, Cordel Line",black,634,C51,2022-07-24,2277,2270,41.6,24.4,33.9,1.e4 e5 2.Nf3 Nc6 3.Bc4 Bc5 4.b4 Bxb4 5.c3 Be7 6.d4 Na5
"Italian Game, Evans Gambit, Declined",black,573,C51,2022-07-24,2261,2257,41.4,21.5,37.2,1.e4 e5 2.Nf3 Nc6 3.Bc4 Bc5 4.b4 Bb6
"Italian Game, Evans Gambit, MacDonnell Defense",black,247,C51,2022-07-24,1664,1668,19.8,9.7,70.5,1.e4 e5 2.Nf3 Nc6 3.Bc4 Bc5 4.b4 Bxb4 5.c3 Bc5
"Italian Game, Evans Gambit, MacDonnell Defense, Main Line",black,164,C51,2022-07-24,2200,2283,34.8,6.1,59.1,1.e4 e5 2.Nf3 Nc6 3.Bc4 Bc5 4.b4 Bxb4 5.c3 Bc5 6.d4 exd4 7.O-O d6 8.cxd4 Bb6
"Italian Game, Evans Gambit, Main Line",black,163,C52,2022-07-07,2055,2048,42.3,22.7,35.0,1.e4 e5 2.Nf3 Nc6 3.Bc4 Bc5 4.b4 Bxb4 5.c3 Ba5
"Italian Game, Evans Gambit, Mieses Defense",black,214,C52,2022-05-25,2101,2047,45.8,14.5,39.7,1.e4 e5 2.Nf3 Nc6 3.Bc4 Bc5 4.b4 Bxb4 5.c3 Ba5 6.d4 exd4 7.O-O Nge7
"Italian Game, Evans Gambit, Pierce Defense",black,280,C52,2022-07-24,2043,2043,36.1,15.0,48.9,1.e4 e5 2.Nf3 Nc6 3.Bc4 Bc5 4.b4 Bxb4 5.c3 Ba5 6.d4 exd4
"Italian Game, Evans Gambit, Slow Variation",white,121,C52,2022-06-22,2164,2125,44.6,15.7,39.7,1.e4 e5 2.Nf3 Nc6 3.Bc4 Bc5 4.b4 Bxb4 5.c3 Ba5 6.O-O
"Italian Game, Evans Gambit, Stone-Ware Variation",black,219,C51,2022-07-24,2209,2222,40.6,15.5,43.8,1.e4 e5 2.Nf3 Nc6 3.Bc4 Bc5 4.b4 Bxb4 5.c3 Bd6
"Italian Game, Evans Gambit, Tartakower Attack",white,361,C52,2022-07-24,2278,2288,36.3,24.9,38.8,1.e4 e5 2.Nf3 Nc6 3.Bc4 Bc5 4.b4 Bxb4 5.c3 Ba5 6.d4 d6 7.Qb3
"Italian Game, General",white,2071,C50,2022-07-24,2046,1979,50.9,21.3,27.9,1.e4 e5 2.Nf3 Nc6 3.Bc4
"Italian Game, Giuoco Pianissimo",white,1632,C50,2022-07-24,1813,1820,42.3,21.5,36.1,1.e4 e5 2.Nf3 Nc6 3.Bc4 Bc5 4.d3
"Italian Game, Giuoco Pianissimo, Canal Variation",white,1263,C50,2022-07-07,2038,2033,32.9,29.8,37.3,1.e4 e5 2.Nf3 Nc6 3.Bc4 Bc5 4.d3 Nf6 5.Nc3 d6 6.Bg5
"Italian Game, Giuoco Pianissimo, Italian Four Knights Variation",white,3490,C50,2022-07-24,1887,1868,34.6,25.0,40.4,1.e4 e5 2.Nf3 Nc6 3.Bc4 Bc5 4.d3 Nf6 5.Nc3
"Italian Game, Giuoco Pianissimo, Normal",black,6486,C50,2022-07-24,2174,2186,33.6,27.0,39.4,1.e4 e5 2.Nf3 Nc6 3.Bc4 Bc5 4.d3 Nf6
"Italian Game, Hungarian Defense",black,4128,C50,2022-07-24,1923,1969,29.5,23.3,47.3,1.e4 e5 2.Nf3 Nc6 3.Bc4 Be7
"Italian Game, Hungarian Defense, Tartakower Variation",black,123,C50,2022-06-26,1924,2005,26.0,20.3,53.7,1.e4 e5 2.Nf3 Nc6 3.Bc4 Be7 4.d4 exd4 5.c3 Nf6 6.e5 Ne4
"Italian Game, Italian Variation",black,7496,C50,2022-07-27,2100,2107,34.6,27.9,37.5,1.e4 e5 2.Nf3 Nc6 3.Bc4 Bc5
"Italian Game, Rosentreter Gambit",white,105,C50,2022-07-24,1898,1958,36.2,11.4,52.4,1.e4 e5 2.Nf3 Nc6 3.Bc4 Bc5 4.d4
"Italian Game, Rousseau Gambit",black,108,C50,2022-03-29,2003,1983,50.0,6.5,43.5,1.e4 e5 2.Nf3 Nc6 3.Bc4 f5
"Italian Game, Schilling-Kostic Gambit",black,324,C50,2022-02-17,1600,1628,39.2,11.4,49.4,1.e4 e5 2.Nf3 Nc6 3.Bc4 Nd4
"Italian Game, Scotch Gambit",white,100,C55,2022-07-01,1969,1875,62.0,17.0,21.0,1.e4 e5 2.Nf3 Nc6 3.Bc4 Nf6 4.d4 exd4 5.O-O
"Italian Game, Scotch Gambit, Anderssen Attack",white,1981,C56,2022-07-24,2135,2104,27.9,34.8,37.3,1.e4 e5 2.Nf3 Nc6 3.Bc4 Nf6 4.d4 exd4 5.O-O Nxe4 6.Re1 d5 7.Bxd5 Qxd5 8.Nc3
"Italian Game, Scotch Gambit, Anderssen Attack, Main Line",white,104,C56,2022-03-22,2204,2193,25.0,50.0,25.0,1.e4 e5 2.Nf3 Nc6 3.Bc4 Nf6 4.d4 exd4 5.O-O Nxe4 6.Re1 d5 7.Bxd5 Qxd5 8.Nc3 Qa5 9.Nxe4 Be6 10.Bd2 Qd5 11.Bg5
"Italian Game, Scotch Gambit, Canal Variation",white,103,C56,2022-04-19,2309,2245,41.8,29.1,29.1,1.e4 e5 2.Nf3 Nc6 3.Bc4 Nf6 4.d4 exd4 5.O-O Nxe4 6.Re1 d5 7.Nc3
"Italian Game, Scotch Gambit, De Riviere Defense",black,333,C55,2022-07-24,1927,1956,35.4,18.9,45.6,1.e4 e5 2.Nf3 Nc6 3.Bc4 Nf6 4.d4 exd4 5.O-O Be7
"Italian Game, Scotch Gambit, Declined",black,117,C55,2022-07-06,1724,1778,18.8,10.3,70.9,1.e4 e5 2.Nf3 Nc6 3.Bc4 Nf6 4.d4 d6
"Italian Game, Scotch Gambit, Janowski Defense",black,418,C55,2022-07-23,2008,2040,38.8,22.7,38.5,1.e4 e5 2.Nf3 Nc6 3.Bc4 Nf6 4.d4 exd4 5.O-O d6
"Italian Game, Scotch Gambit, Max Lange Attack",black,699,C55,2022-07-24,1931,1990,32.3,14.9,52.8,1.e4 e5 2.Nf3 Nc6 3.Bc4 Nf6 4.d4 exd4 5.O-O Bc5
"Italian Game, Scotch Gambit, Max Lange Attack, Long Variation",white,266,C55,2022-03-08,2128,2127,35.3,19.6,45.1,1.e4 e5 2.Nf3 Nc6 3.Bc4 Nf6 4.d4 exd4 5.O-O Bc5 6.e5 d5 7.exf6 dxc4 8.Re1+ Be6 9.Ng5 Qd5 10.Nc3 Qf5 11.Nce4
"Italian Game, Scotch Gambit, Max Lange Attack, Spielmann Defense",black,131,C56,2022-07-13,1697,1732,25.9,12.2,61.8,1.e4 e5 2.Nf3 Nc6 3.Bc4 Nf6 4.d4 exd4 5.O-O Bc5 6.e5 Ng4
"Italian Game, Scotch Gambit, Nakhmanson Gambit",white,106,C56,2022-04-05,2209,2198,36.8,11.3,51.9,1.e4 e5 2.Nf3 Nc6 3.Bc4 Nf6 4.d4 exd4 5.O-O Nxe4 6.Nc3
"Italian Game, Scotch Gambit, Walbrodt-Baird Gambit",white,266,C55,2022-06-03,2007,1974,42.1,24.4,33.5,1.e4 e5 2.Nf3 Nc6 3.Bc4 Nf6 4.d4 exd4 5.O-O Bc5 6.c3
"Italian Game, Two Knights Defense",black,912,C55,2022-07-24,1988,1989,42.9,18.8,38.4,1.e4 e5 2.Nf3 Nc6 3.Bc4 Nf6
"Italian Game, Two Knights Defense, Fried Liver Attack",white,425,C57,2022-07-24,1751,1671,75.3,5.9,18.8,1.e4 e5 2.Nf3 Nc6 3.Bc4 Nf6 4.Ng5 d5 5.exd5 Nxd5 6.Nxf7
"Italian Game, Two Knights Defense, Fritz Variation",black,618,C57,2022-07-02,2019,2037,42.2,17.1,40.6,1.e4 e5 2.Nf3 Nc6 3.Bc4 Nf6 4.Ng5 d5 5.exd5 Nd4
"Italian Game, Two Knights Defense, Knight Attack",white,106,C57,2022-07-24,1724,1592,84.0,5.7,10.4,1.e4 e5 2.Nf3 Nc6 3.Bc4 Nf6 4.Ng5
"Italian Game, Two Knights Defense, Knight Attack, Normal Variation",black,196,C57,2022-02-27,1481,1480,32.6,15.8,51.5,1.e4 e5 2.Nf3 Nc6 3.Bc4 Nf6 4.Ng5 d5
"Italian Game, Two Knights Defense, Lolli Attack",white,100,C57,2022-07-01,1855,1804,70.0,12.0,18.0,1.e4 e5 2.Nf3 Nc6 3.Bc4 Nf6 4.Ng5 d5 5.exd5 Nxd5 6.d4
"Italian Game, Two Knights Defense, Modern Bishop's Opening",white,13775,C55,2022-07-24,2247,2209,40.1,28.5,31.4,1.e4 e5 2.Nf3 Nc6 3.Bc4 Nf6 4.d3
"Italian Game, Two Knights Defense, Perreux Variation",white,514,C55,2022-05-14,2110,2105,37.0,26.1,37.0,1.e4 e5 2.Nf3 Nc6 3.Bc4 Nf6 4.d4 exd4 5.Ng5
"Italian Game, Two Knights Defense, Polerio Defense",black,106,C57,2022-07-24,1725,1714,62.3,11.3,26.4,1.e4 e5 2.Nf3 Nc6 3.Bc4 Nf6 4.Ng5 d5 5.exd5 Na5
"Italian Game, Two Knights Defense, Polerio Defense, Bishop Check line",white,1973,C58,2022-07-27,2188,2137,44.0,20.6,35.4,1.e4 e5 2.Nf3 Nc6 3.Bc4 Nf6 4.Ng5 d5 5.exd5 Na5 6.Bb5+
"Italian Game, Two Knights Defense, Polerio Defense, Bogoljubow Variation",white,912,C58,2022-07-08,2085,2046,41.8,16.6,41.7,1.e4 e5 2.Nf3 Nc6 3.Bc4 Nf6 4.Ng5 d5 5.exd5 Na5 6.Bb5+ c6 7.dxc6 bxc6 8.Qf3
"Italian Game, Two Knights Defense, Polerio Defense, Kieseritsky Variation",white,305,C58,2022-03-12,2069,2038,42.6,19.0,38.4,1.e4 e5 2.Nf3 Nc6 3.Bc4 Nf6 4.Ng5 d5 5.exd5 Na5 6.d3
"Italian Game, Two Knights Defense, Polerio Defense, Suhle Defense",black,1310,C59,2022-07-24,2139,2165,39.5,21.8,38.8,1.e4 e5 2.Nf3 Nc6 3.Bc4 Nf6 4.Ng5 d5 5.exd5 Na5 6.Bb5+ c6 7.dxc6 bxc6 8.Be2 h6
"Italian Game, Two Knights Defense, Traxler Counterattack, Bishop sac line",white,271,C57,2022-07-24,2118,2087,42.4,21.0,36.5,1.e4 e5 2.Nf3 Nc6 3.Bc4 Nf6 4.Ng5 Bc5 5.Bxf7+
"Italian Game, Two Knights Defense, Traxler Counterattack, Knight sac line",white,157,C57,2022-07-24,1815,1851,28.7,19.1,52.2,1.e4 e5 2.Nf3 Nc6 3.Bc4 Nf6 4.Ng5 Bc5 5.Nxf7
"Italian Game, Two Knights Defense, Ulvestad Variation",black,578,C57,2022-07-25,2052,2068,44.8,16.8,38.4,1.e4 e5 2.Nf3 Nc6 3.Bc4 Nf6 4.Ng5 d5 5.exd5 b5
"Kadas Opening, General",white,449,A00,2022-07-24,2241,2231,46.5,12.9,40.5,1.h4
"Kangaroo Defense, General",black,2996,E00,2022-06-28,2311,2363,26.1,37.8,36.1,1.d4 e6 2.c4 Bb4+
"Kangaroo Defense, Keres Defense, Transpositional Variation",white,822,E00,2022-04-20,2307,2288,31.8,29.3,38.9,1.d4 e6 2.c4 Bb4+ 3.Nc3
"King Pawn Game, Alapin Opening",white,138,C20,2022-07-08,2276,2240,41.3,22.5,36.2,1.e4 e5 2.Ne2
"King Pawn Game, Busch-Gass Gambit",black,125,C40,2022-07-24,1425,1549,18.4,7.2,74.4,1.e4 e5 2.Nf3 Bc5
"King Pawn Game, Dresden Opening",white,104,C44,2022-04-13,1838,1810,36.5,14.4,49.0,1.e4 e5 2.Nf3 Nc6 3.c4
"King Pawn Game, General",black,369,C20,2022-06-30,1888,1901,35.0,17.6,47.4,1.e4 e5
"King Pawn Game, Leonardis Variation",white,491,C20,2022-03-22,1859,1893,32.4,14.7,53.0,1.e4 e5 2.d3
"King Pawn Game, Macleod Attack",white,161,C20,2022-07-24,1792,1811,37.9,18.0,44.1,1.e4 e5 2.c3
"King Pawn Game, Maroczy Defense",black,679,B07,2022-07-23,1997,2050,29.0,29.0,42.0,1.e4 d6 2.d4 e5
"King Pawn Game, Tayler Opening",white,412,C44,2022-06-18,2128,2124,36.4,27.7,35.9,1.e4 e5 2.Nf3 Nc6 3.Be2
"King Pawn Game, Tayler Opening, Inverted Hanham",white,595,C44,2022-07-26,2263,2284,34.1,34.0,31.9,1.e4 e5 2.Nf3 Nc6 3.Be2 Nf6 4.d3 d5 5.Nbd2
"King Pawn Game, Wayward Queen Attack",white,164,C20,2022-07-25,1945,1958,42.7,17.7,39.6,1.e4 e5 2.Qh5
"King's Gambit, Accepted, Abbazia Defense",black,1499,C36,2022-07-23,2180,2202,36.1,25.1,38.8,1.e4 e5 2.f4 exf4 3.Nf3 d5 4.exd5 Nf6
"King's Gambit, Accepted, Becker Defense",black,263,C34,2022-03-13,2234,2230,44.9,17.1,38.0,1.e4 e5 2.f4 exf4 3.Nf3 h6
"King's Gambit, Accepted, Bishop's Gambit",white,572,C33,2022-07-14,2268,2240,42.8,18.5,38.6,1.e4 e5 2.f4 exf4 3.Bc4
"King's Gambit, Accepted, Bishop's Gambit, Bledow Countergambit",black,159,C33,2022-04-12,2270,2305,42.8,18.2,39.0,1.e4 e5 2.f4 exf4 3.Bc4 d5 4.Bxd5 Nf6
"King's Gambit, Accepted, Bishop's Gambit, Bogoljubow Defense",black,326,C33,2022-02-15,2282,2313,35.3,28.8,35.9,1.e4 e5 2.f4 exf4 3.Bc4 Nf6 4.Nc3 c6
"King's Gambit, Accepted, Bishop's Gambit, Bogoljubow Variation",white,223,C33,2022-04-19,2352,2336,43.5,18.8,37.7,1.e4 e5 2.f4 exf4 3.Bc4 Nf6 4.Nc3
"King's Gambit, Accepted, Bishop's Gambit, Cozio Variation",black,144,C33,2022-01-29,2224,2176,42.4,23.6,34.0,1.e4 e5 2.f4 exf4 3.Bc4 Qh4+ 4.Kf1 d6
"King's Gambit, Accepted, Bishop's Gambit, Maurian Defense",black,103,C33,2022-07-11,2112,2128,35.0,13.6,51.5,1.e4 e5 2.f4 exf4 3.Bc4 Nc6
"King's Gambit, Accepted, Bonsch-Osmolovsky Variation",black,354,C34,2022-04-10,2284,2258,50.6,24.6,24.9,1.e4 e5 2.f4 exf4 3.Nf3 Ne7
"King's Gambit, Accepted, Cunningham Defense",black,361,C35,2021-11-01,2056,2090,32.4,19.9,47.6,1.e4 e5 2.f4 exf4 3.Nf3 Be7
"King's Gambit, Accepted, Cunningham Defense, McCormick Defense",black,255,C35,2022-07-08,2262,2272,40.8,23.1,36.1,1.e4 e5 2.f4 exf4 3.Nf3 Be7 4.Bc4 Nf6
"King's Gambit, Accepted, Fischer Defense",black,1049,C34,2022-07-23,2099,2102,39.4,15.3,45.4,1.e4 e5 2.f4 exf4 3.Nf3 d6
"King's Gambit, Accepted, Greco Gambit",black,113,C38,2022-01-18,2340,2262,56.6,13.3,30.1,1.e4 e5 2.f4 exf4 3.Nf3 g5 4.Bc4 Bg7 5.h4 h6 6.d4 d6
"King's Gambit, Accepted, Hanstein Gambit",white,148,C38,2021-11-27,2106,2143,35.1,15.5,49.3,1.e4 e5 2.f4 exf4 3.Nf3 g5 4.Bc4 Bg7 5.O-O
"King's Gambit, Accepted, Kieseritsky Gambit, Kolisch Defense",black,180,C39,2022-01-04,2292,2253,46.7,25.6,27.8,1.e4 e5 2.f4 exf4 3.Nf3 g5 4.h4 g4 5.Ne5 d6
"King's Gambit, Accepted, Kieseritsky Gambit, Rubinstein Variation",white,106,C39,2020-01-04,2289,2300,34.9,27.4,37.7,1.e4 e5 2.f4 exf4 3.Nf3 g5 4.h4 g4 5.Ne5 Nf6 6.d4
"King's Gambit, Accepted, King's Knight Gambit",white,148,C34,2022-07-05,1956,1865,59.5,12.8,27.7,1.e4 e5 2.f4 exf4 3.Nf3
"King's Gambit, Accepted, MacLeod Defense",black,261,C34,2022-07-24,1651,1674,22.2,13.0,64.8,1.e4 e5 2.f4 exf4 3.Nf3 Nc6
"King's Gambit, Accepted, Mason-Keres Gambit",white,150,C33,2022-02-22,2216,2239,36.7,23.3,40.0,1.e4 e5 2.f4 exf4 3.Nc3
